{
  "schema_version": "1.0.0",
  "registry_id": "references.skill_repos",
  "purpose": "A curated registry of the most popular public skill repositories, used to fetch a specific skill on demand as a learning reference for structure and content organization.",
  "stars_note": "stargazers_count, default_branch, and license were verified via `gh api repos/<owner>/<name>` and captured 2026-06; refresh the same way. license 'see-repo' means GitHub did not detect a single SPDX license.",
  "learning_note": "Learn how these skills organize content, triggers, and assets — do NOT copy. An industrial skill must also cover control boundaries, test assets, quantitative metrics, lifecycle, and an evidence base (see docs/research/skill_reference_library.md).",
  "repos": [
    {
      "id": "repo.anthropics_skills",
      "name": "skills",
      "owner": "anthropics",
      "repo": "anthropics/skills",
      "url": "https://github.com/anthropics/skills",
      "approx_stars": 145708,
      "category": "official",
      "license": "see-repo",
      "default_branch": "main",
      "what_to_learn_zh": "Anthropic 官方 SKILL.md 的 frontmatter 结构、触发描述写法，以及 scripts/references/agents 子目录如何组成自包含技能包。",
      "what_to_learn_en": "The canonical SKILL.md frontmatter schema, trigger phrasing for self-selection, and how scripts/references/agents subdirectories co-package a self-contained skill.",
      "example_skill_paths": ["skills/skill-creator/SKILL.md", "skills/mcp-builder/SKILL.md", "skills/webapp-testing/SKILL.md"],
      "caveat": "License not SPDX-detected; document skills (docx/pdf/pptx/xlsx) are source-available, not Apache-2.0."
    },
    {
      "id": "repo.anthropics_claude-plugins-official",
      "name": "claude-plugins-official",
      "owner": "anthropics",
      "repo": "anthropics/claude-plugins-official",
      "url": "https://github.com/anthropics/claude-plugins-official",
      "approx_stars": 29180,
      "category": "official",
      "license": "Apache-2.0",
      "default_branch": "main",
      "what_to_learn_zh": "SKILL.md 如何嵌入更大的 plugin 包结构（.claude-plugin 元数据、commands/、agents/），以及官方质量与安全门的组织方式。",
      "what_to_learn_en": "How SKILL.md skills embed inside a broader plugin package (.claude-plugin metadata, commands/, agents/) and how curated quality/security gates are organized.",
      "example_skill_paths": ["plugins/skill-creator", "plugins/code-review", "plugins/feature-dev"],
      "caveat": "Plugin-level packaging; exact skill paths vary by plugin."
    },
    {
      "id": "repo.addyosmani_agent-skills",
      "name": "agent-skills",
      "owner": "addyosmani",
      "repo": "addyosmani/agent-skills",
      "url": "https://github.com/addyosmani/agent-skills",
      "approx_stars": 47830,
      "category": "community",
      "license": "MIT",
      "default_branch": "main",
      "what_to_learn_zh": "如何按开发生命周期阶段（定义/计划/构建/验证/审查/发布）分类技能，以及每个 SKILL.md 如何内嵌验证关卡和反合理化表格。",
      "what_to_learn_en": "Categorizing skills by development-lifecycle phase, and how each SKILL.md encodes verification gates and anti-rationalization tables for reliability.",
      "example_skill_paths": ["skills/test-driven-development/SKILL.md", "skills/security-and-hardening/SKILL.md", "skills/using-agent-skills/SKILL.md"],
      "caveat": "Indicative paths; verify against the live tree."
    },
    {
      "id": "repo.sickn33_antigravity-awesome-skills",
      "name": "antigravity-awesome-skills",
      "owner": "sickn33",
      "repo": "sickn33/antigravity-awesome-skills",
      "url": "https://github.com/sickn33/antigravity-awesome-skills",
      "approx_stars": 39512,
      "category": "collection",
      "license": "MIT",
      "default_branch": "main",
      "what_to_learn_zh": "大规模技能库如何设计机器可读的 skills_index.json 清单和 CATALOG.md 注册表，以及如何通过 npm CLI 跨平台分发。",
      "what_to_learn_en": "How a large-scale library designs a machine-readable skills_index.json manifest and CATALOG.md registry, and distributes via an npm CLI across platforms.",
      "example_skill_paths": ["skills/ai-engineer/SKILL.md", "skills/api-design-principles/SKILL.md"],
      "caveat": "1,494+ entries; individual skill quality varies widely."
    },
    {
      "id": "repo.github_awesome-copilot",
      "name": "awesome-copilot",
      "owner": "github",
      "repo": "github/awesome-copilot",
      "url": "https://github.com/github/awesome-copilot",
      "approx_stars": 34327,
      "category": "official",
      "license": "MIT",
      "default_branch": "main",
      "what_to_learn_zh": "GitHub Copilot 生态对 SKILL.md 的适配，以及技能与 instructions（文件模式触发）、hooks、plugins 的关系。",
      "what_to_learn_en": "How GitHub Copilot adapts SKILL.md and how skills relate to instructions (file-pattern triggers), hooks, and plugin bundles.",
      "example_skill_paths": ["skills/"],
      "caveat": "Exact SKILL.md paths under /skills are not all enumerated publicly."
    },
    {
      "id": "repo.vercel-labs_agent-skills",
      "name": "agent-skills",
      "owner": "vercel-labs",
      "repo": "vercel-labs/agent-skills",
      "url": "https://github.com/vercel-labs/agent-skills",
      "approx_stars": 27482,
      "category": "official",
      "license": "see-repo",
      "default_branch": "main",
      "what_to_learn_zh": "如何把框架最佳实践（React/Next.js）编码为 SKILL.md，并维护平行的 AGENTS.md 跨平台兼容文件。",
      "what_to_learn_en": "Encoding framework best-practices (React/Next.js) into SKILL.md alongside a parallel AGENTS.md for cross-agent compatibility.",
      "example_skill_paths": ["skills/web-design-guidelines/SKILL.md", "skills/react-best-practices/SKILL.md"],
      "caveat": "License not SPDX-detected."
    },
    {
      "id": "repo.vercel-labs_skills",
      "name": "skills",
      "owner": "vercel-labs",
      "repo": "vercel-labs/skills",
      "url": "https://github.com/vercel-labs/skills",
      "approx_stars": 21075,
      "category": "framework",
      "license": "see-repo",
      "default_branch": "main",
      "what_to_learn_zh": "技能生态的包管理器如何定义发现路径规则（.claude/skills/ 等），以及 flat layout 与 catalog layout 的组织约定。",
      "what_to_learn_en": "How the skills package manager defines discovery path rules and flat-layout vs catalog-layout conventions for SKILL.md.",
      "example_skill_paths": ["skills/find-skills/SKILL.md"],
      "caveat": "Tooling/package-manager repo rather than skill content; license not SPDX-detected."
    },
    {
      "id": "repo.muratcankoylan_agent-skills-for-context-engineering",
      "name": "Agent-Skills-for-Context-Engineering",
      "owner": "muratcankoylan",
      "repo": "muratcankoylan/Agent-Skills-for-Context-Engineering",
      "url": "https://github.com/muratcankoylan/Agent-Skills-for-Context-Engineering",
      "approx_stars": 16273,
      "category": "community",
      "license": "MIT",
      "default_branch": "main",
      "what_to_learn_zh": "如何用 SKILL.md 封装高抽象度知识（上下文压缩、多 agent 编排），以及基础与高级技能的粒度划分。",
      "what_to_learn_en": "Encapsulating high-abstraction knowledge (context compression, multi-agent orchestration) into SKILL.md, and beginner-vs-advanced granularity.",
      "example_skill_paths": ["skills/context-fundamentals/SKILL.md", "skills/multi-agent-patterns/SKILL.md"],
      "caveat": "Indicative paths."
    },
    {
      "id": "repo.alirezarezvani_claude-skills",
      "name": "claude-skills",
      "owner": "alirezarezvani",
      "repo": "alirezarezvani/claude-skills",
      "url": "https://github.com/alirezarezvani/claude-skills",
      "approx_stars": 16959,
      "category": "community",
      "license": "MIT",
      "default_branch": "main",
      "what_to_learn_zh": "如何按企业职能域横向拆分技能，以及每个技能包配套参考文档和自动化脚本的标准化附属结构。",
      "what_to_learn_en": "Partitioning skills by enterprise function domain and standardizing each skill with co-located reference guides plus automation scripts.",
      "example_skill_paths": ["engineering-team/senior-architect/SKILL.md", "engineering-team/senior-backend/SKILL.md"],
      "caveat": "Cross-platform compatibility claims not independently verified."
    },
    {
      "id": "repo.antfu_skills",
      "name": "skills",
      "owner": "antfu",
      "repo": "antfu/skills",
      "url": "https://github.com/antfu/skills",
      "approx_stars": 5163,
      "category": "community",
      "license": "MIT",
      "default_branch": "main",
      "what_to_learn_zh": "如何把个人/团队技术偏好和生态最佳实践编码为 SKILL.md，并用 references/ 子目录卸载细节保持简洁。",
      "what_to_learn_en": "Encoding personal/team tech preferences into SKILL.md and using a references/ subdir to keep the skill file concise.",
      "example_skill_paths": ["skills/antfu/SKILL.md", "skills/vue/SKILL.md", "skills/vite/SKILL.md"],
      "caveat": "Opinionated; reflects one maintainer's ecosystem."
    },
    {
      "id": "repo.microsoft_skills",
      "name": "skills",
      "owner": "microsoft",
      "repo": "microsoft/skills",
      "url": "https://github.com/microsoft/skills",
      "approx_stars": 2447,
      "category": "official",
      "license": "MIT",
      "default_branch": "main",
      "what_to_learn_zh": "如何用 plugin 目录结构按语言维度复用同一服务技能，以及语言无关基础技能放在 .github/skills/ 的组织方式。",
      "what_to_learn_en": "How a plugin directory replicates a service skill per language and places language-agnostic foundation skills under a shared .github/skills/.",
      "example_skill_paths": [".github/skills/skill-creator/SKILL.md", ".github/skills/mcp-builder/SKILL.md"],
      "caveat": "Azure-specific, tightly coupled to Microsoft SDKs."
    },
    {
      "id": "repo.heilcheng_awesome-agent-skills",
      "name": "awesome-agent-skills",
      "owner": "heilcheng",
      "repo": "heilcheng/awesome-agent-skills",
      "url": "https://github.com/heilcheng/awesome-agent-skills",
      "approx_stars": 5283,
      "category": "collection",
      "license": "MIT",
      "default_branch": "main",
      "what_to_learn_zh": "如何对来自不同组织的技能按平台/领域建立可浏览索引，用作发现高质量第三方范例的目录。",